playlist,track_id,name,duration_ms,song_popularity,explicit_lyrics,markets,name_length,lyrics,album,album_type,record_company,genres,month,year,holiday_effect,artist,solo_group,artist_popularity_mean,artist_popularity_max,followers_mean,followers_max,GT_mean_value,GT_std_value,GT_range_value,peak,age,country_code,key,mode,time_signature,acousticness,danceability,energy,instrumentalness,liveness,loudness,speechiness,valence,tempo
top_2018,7vGuf3Y35N4wmASOKLUVVU,Silence,180822,80,False,"['AD', 'AE', 'AR', 'AT', 'AU', 'BE', 'BG', 'BH', 'BO', 'BR', 'CA', 'CH', 'CL', 'CO', 'CR', 'CY', 'CZ', 'DE', 'DK', 'DO', 'DZ', 'EC', 'EE', 'EG', 'ES', 'FI', 'FR', 'GB', 'GR', 'GT', 'HK', 'HN', 'HU', 'ID', 'IE', 'IL', 'IN', 'IS', 'IT', 'JO', 'JP', 'KW', 'LB', 'LI', 'LT', 'LU', 'LV', 'MA', 'MC', 'MT', 'MX', 'MY', 'NI', 'NL', 'NO', 'NZ', 'OM', 'PA', 'PE', 'PH', 'PL', 'PS', 'PT', 'PY', 'QA', 'RO', 'SA', 'SE', 'SG', 'SK', 'SV', 'TH', 'TN', 'TR', 'TW', 'US', 'UY', 'VN', 'ZA']",7, yeah id rather be a lover than a fighter cause all my life ive been fighting never felt a feeling of comfort all this time ive been hiding and i never had someone to call my own oh nah im so used to sharing love only left me alone but im at one with the silence i found peace in your violence cant tell me theres no point in trying im at one and ive been quiet for too long i found peace in your violence cant tell me theres no point in trying im at one and ive been silent for too long ive been quiet for too long ive been quiet for too long im in need of a savior but im not asking for favors my whole life ive felt like a burden i think too much and i hate it im so used to being in the wrong im tired of caring loving never gave me a home so ill sit here in the silence i found peace in your violence cant tell me theres no point in trying im at one and ive been quiet for too long i found peace in your violence cant tell me theres no point in trying im at one and ive been silent for too long ive been quiet for too long i found peace in your violence cant tell me theres no point in trying im at one and ive been quiet for too long ,Silence,single,"Independent, Sony",r&b,8,2017,1,"['Marshmello', 'Khalid']",group_male,90.0,93,17287686.0,23280041,65.72043010752688,9.077920561146833,50.0,"[1, 0]",24,US,4,1,4,0.256,0.52,0.761,4.96e-06,0.17,-3.093,0.0853,0.286,141.971
top_2018,5OCJzvD7sykQEKHH7qAC3C,God is a woman,197546,80,True,"['AD', 'AE', 'AR', 'AT', 'AU', 'BE', 'BG', 'BH', 'BO', 'BR', 'CA', 'CH', 'CL', 'CO', 'CR', 'CY', 'CZ', 'DE', 'DK', 'DO', 'DZ', 'EC', 'EE', 'EG', 'ES', 'FI', 'FR', 'GB', 'GR', 'GT', 'HK', 'HN', 'HU', 'ID', 'IE', 'IL', 'IN', 'IS', 'IT', 'JO', 'JP', 'KW', 'LB', 'LI', 'LT', 'LU', 'LV', 'MA', 'MC', 'MT', 'MX', 'MY', 'NI', 'NL', 'NO', 'NZ', 'OM', 'PA', 'PE', 'PH', 'PL', 'PS', 'PT', 'PY', 'QA', 'RO', 'SA', 'SE', 'SG', 'SK', 'SV', 'TH', 'TN', 'TR', 'TW', 'US', 'UY', 'VN', 'ZA']",14, you you love it how i move you you love it how i touch you my one when all is said and done youll believe god is a woman and i i feel it after midnight a feelin that you cant fight my one it lingers when were done youll believe god is a woman i dont wanna waste no time yeah you aint got a onetrack mind yeah have it any way you like yeah and i can tell that you know i know how i want it aint nobody else can relate boy i like that you aint afraid baby lay me down and lets pray im tellin you the way i like it how i want it and i can be all the things you told me not to be when you try to come for me i keep on flourishing and he see the universe when im the company its all in me you you love it how i move you you love it how i touch you my one when all is said and done youll believe god is a woman and i i feel it after midnight a feelin that you cant fight my one it lingers when were done youll believe god is a woman i tell you all the things you should know so baby take my hands save your soul we can make it last take it slow hmm and i can tell that you know i know how i want it yeah but youre different from the rest and boy if you confess you might get blessed see if you deserve what comes next im tellin you the way i like it how i want it and i can be all the things you told me not to be when you try to come for me i keep on flourishing and he see the universe when im the company its all in me you you love it how i move you you love it how i touch you my one when all is said and done youll believe god is a woman and i i feel it after midnight a feelin that you cant fight my one it lingers when were done youll believe god is a woman yeah yeah yeah yeah my one when all is said and done youll believe god is a woman youll believe god oh yeah it lingers when were done youll believe god is a woman ,Sweetener,album,Universal,pop,8,2018,1,['Ariana Grande'],solo_female,92.0,92,45042400.0,45042400,30.483870967741936,14.777048083772556,82.0,[0],26,US,1,1,4,0.0233,0.602,0.658,6e-05,0.237,-5.934,0.0558,0.268,145.031
top_2018,1j6xOGusnyXq3l6IryKF3G,Déjala Que Vuelva (feat. Manuel Turizo),220116,71,False,"['AD', 'AE', 'AR', 'AT', 'AU', 'BE', 'BG', 'BH', 'BO', 'BR', 'CA', 'CH', 'CL', 'CO', 'CR', 'CY', 'CZ', 'DE', 'DK', 'DO', 'DZ', 'EC', 'EE', 'EG', 'ES', 'FI', 'FR', 'GB', 'GR', 'GT', 'HK', 'HN', 'HU', 'ID', 'IE', 'IL', 'IN', 'IS', 'IT', 'JO', 'JP', 'KW', 'LB', 'LI', 'LT', 'LU', 'LV', 'MA', 'MC', 'MT', 'MX', 'MY', 'NI', 'NL', 'NO', 'NZ', 'OM', 'PA', 'PE', 'PH', 'PL', 'PS', 'PT', 'PY', 'QA', 'RO', 'SA', 'SE', 'SG', 'SK', 'SV', 'TH', 'TN', 'TR', 'TW', 'US', 'UY', 'VN', 'ZA']",17,  déjala que vuelva ay ya ya como podrás respirar cuando te falte mi piel si fuiste tú quien se alejó pero esta vez no me dolió baby no quiero verte llorar por mí entiendo no sabes perder aunque esta vez no va a ser tan fácil yo te lo juro no va a ser tan fácil lo hiciste difícil la tengo clara si preguntan por ti diré volverá como la primera vez déjala que vuelva ella conoce solita el camino conmigo volverá como la primera vez déjala que vuelva ella conoce solita el camino conmigo tu cuerpo sabes que no dejo de pensar en tus besos no hay nada más rico que probar tu boca pero esta vez mamacita no está fácil la cosa tu cuerpo sabes que no dejo de pensar en tus besos no hay nada más rico que probar tu boca pero esta vez mamacita no está fácil la cosa volverá como la primera vez déjala que vuelva ella conoce solita el camino conmigo volverá como la primera vez déjala que vuelva ella conoce solita el camino conmigo baby yo sé que tú también verás lo que es no poder tener lo quieres yo sé que es lo que tú quieres que yo me desespere y te vuelva a ver por favor no le insistas déjala que juegue sola ya no le insistas sabes que por volver ella muere esta vez no le daré lo que ella quiere volverá como la primera vez déjala que vuelva ella conoce solita el camino conmigo volverá como la primera vez déjala que vuelva ella conoce solita el camino conmigo como podrás respirar cuando te falte mi piel si fuiste tú quien se alejó pero esta vez no me dolió baby no quiero verte llorar por mí entiendo no sabes perder aunque esta vez volverá como la primera vez déjala que vuelva ella conoce solita el camino conmigo wuo volverá piso 21 manuel turizo julián turizo volverá momomosty wain ,Ubuntu,album,Warner,latin/reggaeton,5,2018,1,"['Piso 21', 'Manuel Turizo']",group_male,83.0,85,5428880.5,5450816,48.32258064516129,15.430235419430636,77.0,"[1, 0]",29,CO,1,1,4,0.0482,0.681,0.788,0.0,0.0753,-4.323,0.0785,0.839,170.019
top_2018,66BjcDhhwWCcQIBxHMpKXh,Flames,194680,66,False,"['AD', 'AE', 'AR', 'AT', 'AU', 'BE', 'BG', 'BH', 'BO', 'BR', 'CH', 'CL', 'CO', 'CR', 'CY', 'CZ', 'DE', 'DK', 'DO', 'DZ', 'EC', 'EE', 'EG', 'ES', 'FI', 'FR', 'GB', 'GR', 'GT', 'HK', 'HN', 'HU', 'ID', 'IE', 'IL', 'IN', 'IS', 'IT', 'JO', 'JP', 'KW', 'LB', 'LI', 'LT', 'LU', 'LV', 'MA', 'MC', 'MT', 'MY', 'NI', 'NL', 'NO', 'NZ', 'OM', 'PA', 'PE', 'PH', 'PL', 'PS', 'PT', 'PY', 'QA', 'RO', 'SA', 'SE', 'SG', 'SK', 'SV', 'TH', 'TN', 'TR', 'TW', 'UY', 'VN', 'ZA']",6, oh oh one foot in front of the other babe one breath leads to another yeah just keep moving oh look within for the strength today listen out for the voice to say just keep moving oh go go go figure it out figure it out but dont stop moving go go go figure it out figure it out you can do this so my love keep on running you gotta get through today there my love keep on running gotta keep those tears at bay oh my love dont stop burning gonna send them up in flames in flames dont stop tomorrows another day dont stop tomorrow youll feel no pain just keep moving dont stop the pastll trip you up you know right nows gotta be enough just keep moving go go go figure it out figure it out but dont stop moving go go go figure it out figure it out you can do this so my love keep on running you gotta get through today there my love keep on running gotta keep those tears at bay oh my love dont stop burning gonna send them up in flames in flames in flames in flames go go go figure it out figure it out but dont stop moving go go go figure it out figure it out you can do this so my love keep on running you gotta get through today then my love keep on running gotta keep those tears at bay oh my love dont stop burning gonna send them up in flames in flames ,7,album,Warner,pop,9,2018,0,"['David Guetta', 'Sia']",group_mixed,87.0,88,18763074.0,21242602,61.784946236559136,10.444056803262521,53.5,"[0, 0]",48,"AU, FR",5,0,4,0.0817,0.631,0.649,3.8e-06,0.0934,-5.892,0.0385,0.421,93.95
top_2018,0WdGQhoAP2LBsqr5Jhit2g,What Lovers Do,199849,38,False,"['AE', 'BH', 'DZ', 'EG', 'JO', 'KW', 'LB', 'MA', 'OM', 'QA', 'SA', 'TN']",14, say say say hey hey now baby oh mama dont play now baby say say say hey hey now baby said lets get one thing straight now baby tell me tell me if you love me or not love me or not love me or not ill bet the house on you am i lucky or not lucky or not lucky or not you gotta tell me if you love me or not love me or not love me or not been wishin for you am i lucky or not lucky or not lucky or not ooooh oooh been wishin for you ooh ooh tryna do what lovers do ooooh oooh been wishin for you ooh ooh tryna do what lovers do say say say hey hey now baby you gonna make me hit you with that lay down baby say say say hey hey now baby you know what i need out the gate now baby tell me tell me if you love me or not love me or not love me or not ill bet the house on you am i lucky or not lucky or not lucky or not you gotta tell me if you love me or not love me or not love me or not been wishin for you am i lucky or not lucky or not lucky or not ooooh oooh been wishin for you ooh ooh tryna do what lovers do ooooh oooh been wishin for you ooh ooh tryna do what lovers do what lovers do what lovers do what lovers do arent we too grown for games arent we too grown to play around young enough to chase but old enough to know better are we too grown for changin are we too grown to mess around ooh and i cant wait forever baby both of us should know better ooooh oooh been wishin for you ooh ooh tryna do what lovers do ooooh oooh been wishin for you ooh ooh tryna do what lovers do ooooh oooh been wishin for you ooh ooh tryna do what lovers do ooooh oooh been wishin for you ooh ooh tryna do what lovers do ooooh oooh been wishin for you ooh ooh tryna do what lovers do ,Red Pill Blues (Deluxe),album,Universal,pop,11,2017,0,"['Maroon 5', 'SZA']",group_mixed,86.5,90,13620120.0,23972186,52.74193548387096,12.124305146730485,66.0,"[0, 0]",40,US,5,0,4,0.0788,0.799,0.597,5.66e-06,0.1,-5.131,0.0611,0.419,110.001
top_2018,4w8niZpiMy6qz1mntFA5uM,"Taki Taki (with Selena Gomez, Ozuna & Cardi B)",212500,82,True,"['AD', 'AE', 'AR', 'AT', 'AU', 'BE', 'BG', 'BH', 'BO', 'BR', 'CA', 'CH', 'CL', 'CO', 'CR', 'CY', 'CZ', 'DE', 'DK', 'DO', 'DZ', 'EC', 'EE', 'EG', 'ES', 'FI', 'FR', 'GB', 'GR', 'GT', 'HK', 'HN', 'HU', 'ID', 'IE', 'IL', 'IN', 'IS', 'IT', 'JO', 'KW', 'LB', 'LI', 'LT', 'LU', 'LV', 'MA', 'MC', 'MT', 'MX', 'MY', 'NI', 'NL', 'NO', 'NZ', 'OM', 'PA', 'PE', 'PH', 'PL', 'PS', 'PT', 'PY', 'QA', 'RO', 'SA', 'SE', 'SG', 'SK', 'SV', 'TH', 'TN', 'TR', 'TW', 'US', 'UY', 'VN', 'ZA']",9,wooh ohoh báilame como si fuera la última vez y enséñame ese pasito que no sé un besito bien suavecito bebé taki taki taki taki rumba wooh ohoh hi music hi flow báilame como si fuera la última vez y enséñame ese pasito que no sé un besito bien suavecito bebé taki taki taki taki taki taki quiere un besito o un ñaqui booty explota como nagasaki prende los motores kawasaki que la disco está llena y llegaron los anunnakis no le bajes el booty sobresale de tu traje no trajo pantisito pa que el nene no trabaje es que yo me sé lo que ella cree que ella se sabe cuenta que no quiere pero me tiene espionaje eheh el booty sobresale de tu traje no trajo pantisito pa que el nene no trabaje es que yo me sé lo que ella cree que ella se sabe cuenta que no quiere pero me tiene espionaje eheh báilame como si fuera la última vez y enséñame ese pasito que no sé un besito bien suavecito bebé taki taki taki taki rumba wooh ohoh hi music hi flow bardi he said he wanna to touch it and tease it and squeeze it well my piggy bank is hungry my nigga you need to feed it if the text aint freaky i dont wanna read it and just to let you know this punani is undefeated ayy he said he really wanna see me more i said we should have a datewhere at the lamborghini store im kinda scary hard to read im like a ouija board but im a boss bitch who you gonna leave me for you hoes got no class you bitches is broke still i be talking cash shit while im popping my gold grill im a whole rich bitch and i work like im broke still but the love be so fake but the hate be so real uh el booty sobresale de mi traje no traje pantisito pa que el nene no trabaje e que yo me sé lo que tú cree que tú no sabe dice que no quiere pero se quiere comer el equipaje báilame como si fuera la última vez y enséñame ese pasito que no sé un besito bien suavecito bebé taki taki taki taki rumba wooh ohoh careful when you come through my way my body already know how to play work it keep it tight everyday and i i i know you need a taste when i ooh youre fallin in love give a little oohooh get it well done dancing on my ooh make your girl wanna run we keep moving til the sun come up porque i am the party yo soy fiesta blow out your candles have a siesta they can try pero no one can stop me what my taki taki wants yeah my taki taki gets uh báilame como si fuera la última vez y enséñame ese pasito que no sé un besito bien suavecito bebé taki taki taki taki rumba wooh ohoh hi music hi flow taki taki taki taki,"Taki Taki (with Selena Gomez, Ozuna & Cardi B)",single,Universal,dance,9,2018,0,"['DJ Snake', 'Selena Gomez', 'Ozuna', 'Cardi B']",group_mixed,88.5,93,15261953.75,22620630,34.233870967741936,11.568464775800543,78.5,"[1, 0, 0, 0]",28,"FR, PR, US",8,0,4,0.157,0.842,0.801,4.82e-06,0.0642,-4.167,0.228,0.617,95.881
top_2018,5Gu0PDLN4YJeW75PpBSg9p,"Let Me Go (with Alesso, Florida Georgia Line & watt)",174800,81,False,"['AD', 'AE', 'AR', 'AT', 'AU', 'BE', 'BG', 'BH', 'BO', 'BR', 'CA', 'CH', 'CL', 'CO', 'CR', 'CY', 'CZ', 'DE', 'DK', 'DO', 'DZ', 'EC', 'EE', 'EG', 'ES', 'FI', 'FR', 'GB', 'GR', 'GT', 'HK', 'HN', 'HU', 'ID', 'IE', 'IL', 'IN', 'IS', 'IT', 'JO', 'JP', 'KW', 'LB', 'LI', 'LT', 'LU', 'LV', 'MA', 'MC', 'MT', 'MX', 'MY', 'NI', 'NL', 'NO', 'NZ', 'OM', 'PA', 'PE', 'PH', 'PL', 'PS', 'PT', 'PY', 'QA', 'RO', 'SA', 'SE', 'SG', 'SK', 'SV', 'TH', 'TN', 'TR', 'TW', 'US', 'UY', 'VN', 'ZA']",9,you made plans and i i made problems we were sleeping back to back we know this thing wasnt built to last good on paper picture perfect chased the high too far too fast picket white fence but we paint it black ooh and i wished you had hurt me harder than i hurt you ooh and i wish you wouldnt wait for me but you always do ive been hopin somebody loves you in the ways i couldnt somebodys taking care of all of the mess ive made someone you dont have to change ive been hopin someone will love you let me go someone will love you let me go ive been hoping someone will love you let me go its been some time but this time aint even i can leave it in the past but youre holding on to what you never had good on paper picture perfect chased the high too far too fast picket white fence but we paint it black ooh and i wished you had hurt me harder than i hurt you ooh and i wish you wouldnt wait for me but you always do ive been hopin somebody loves you in the ways i couldnt somebodys taking care of all of the mess ive made someone you dont have to change ive been hopin someone will love you let me go someone will love you let me go ive been hoping someone will love you let me go someone will love you let me go someone will love you let me go someone will love you let me go someone will love you let me go ive been hoping somebody loves you in the ways i couldnt somebodys taking care of all of the mess ive made someone you dont have to change ive been hoping someone will love you let me go,"Let Me Go (with Alesso, Florida Georgia Line & watt)",single,Universal,pop,9,2017,0,"['Hailee Steinfeld', 'Alesso', 'Florida Georgia Line', 'watt']",group_mixed,77.0,82,3167489.25,5603737,48.13709677419355,13.373668722321465,73.5,"[0, 0, 0, 2]",29,"SE, US",8,1,4,0.0337,0.663,0.708,0.0,0.0841,-4.154,0.0473,0.742,103.073
top_2018,6QgjcU0zLnzq5OrUoSZ3OK,Feel It Still,163253,81,False,"['AD', 'AE', 'AR', 'AT', 'AU', 'BE', 'BG', 'BH', 'BO', 'BR', 'CA', 'CH', 'CL', 'CO', 'CR', 'CY', 'CZ', 'DE', 'DK', 'DO', 'DZ', 'EC', 'EE', 'EG', 'ES', 'FI', 'FR', 'GB', 'GR', 'GT', 'HK', 'HN', 'HU', 'ID', 'IE', 'IL', 'IN', 'IS', 'IT', 'JO', 'JP', 'KW', 'LB', 'LI', 'LT', 'LU', 'LV', 'MA', 'MC', 'MT', 'MX', 'MY', 'NI', 'NL', 'NO', 'NZ', 'OM', 'PA', 'PE', 'PH', 'PL', 'PS', 'PT', 'PY', 'QA', 'RO', 'SA', 'SE', 'SG', 'SK', 'SV', 'TH', 'TN', 'TR', 'TW', 'US', 'UY', 'VN', 'ZA']",13, cant keep my hands to myself think ill dust em off put em back up on the shelf in case my little baby girl is in need am i coming out of left field ooh woo im a rebel just for kicks now i been feeling it since 1966 now might be over now but i feel it still ooh woo im a rebel just for kicks now let me kick it like its 1986 now might be over now but i feel it still got another mouth to feed leave it with a baby sitter mama call the grave digger gone with the fallen leaves am i coming out of left field ooh woo im a rebel just for kicks now i been feeling it since 1966 now mightve had your fill but you feel it still ooh woo im a rebel just for kicks now let me kick it like its 1986 now might be over now but i feel it still we could fight a war for peace give in to that easy living goodbye to my hopes and dreams start flipping for my enemies we could wait until the walls come down its time to give a little to the kids in the middle but oh until it falls wont bother me is it coming is it coming is it coming is it coming is it coming is it coming back ooh woo im a rebel just for kicks yeah your love is an abyss for my heart to eclipse now might be over now but i feel it still ooh woo im a rebel just for kicks now ive been feeling it since 1966 now might be over now but i feel it still ooh woo im a rebel just for kicks now let me kick it like its 1986 now might be over now but i feel it still mightve had your fill but i feel it still ,Woodstock,album,Warner,indie,6,2017,1,['Portugal. The Man'],group_male,72.0,72,1080169.0,1080169,25.397849462365592,16.486582017788464,100.0,[0],37,US,1,0,4,0.0417,0.801,0.795,0.000113,0.0717,-5.115,0.0504,0.754,79.028
top_2018,77UjLW8j5UAGAGVGhR5oUK,Pray For Me (with Kendrick Lamar),211440,77,True,"['AD', 'AE', 'AR', 'AT', 'AU', 'BE', 'BG', 'BH', 'BO', 'BR', 'CA', 'CH', 'CL', 'CO', 'CR', 'CY', 'CZ', 'DE', 'DK', 'DO', 'DZ', 'EC', 'EE', 'EG', 'ES', 'FI', 'FR', 'GB', 'GR', 'GT', 'HK', 'HN', 'HU', 'ID', 'IE', 'IL', 'IN', 'IS', 'IT', 'JO', 'JP', 'KW', 'LB', 'LI', 'LT', 'LU', 'LV', 'MA', 'MC', 'MT', 'MX', 'MY', 'NI', 'NL', 'NO', 'NZ', 'OM', 'PA', 'PE', 'PH', 'PL', 'PS', 'PT', 'PY', 'QA', 'RO', 'SA', 'SE', 'SG', 'SK', 'SV', 'TH', 'TN', 'TR', 'TW', 'US', 'UY', 'VN', 'ZA']",11, ooh ooh ooh ooh im always ready for a war again go down that road again its all the same im always ready to take a life again you know ill ride again its all the same tell me whos gon save me from myself when this life is all i know tell me whos gon save me from this hell without you im all alone who gon pray for me take my pain for me save my soul for me cause im alone you see if im gon die for you if im gon kill for you then i spilled this blood for you hey i fight the world i fight you i fight myself i fight god just tell me how many burdens left i fight pain and hurricanes today i wept im tryna fight back tears flood on my doorsteps life a livin hell puddles of blood in the streets shooters on top of the building government aid aint relief earthquake the body dropped the ground breaks the poor run with smoke lungs and scarface who need a hero you need a hero look in the mirror there go your hero who on the front lines at ground zero my heart dont skip a beat even when hard times bumps the needle mass destruction and mass corruption the souls of sufferin men clutchin on deaf ears again rapture is comin its all prophecy and if i gotta be sacrificed for the greater good then thats what it gotta be who gon pray for me take my pain for me save my soul for me cause im alone you see if im gon die for you if im gon kill for you then i spilled this blood for you hey hey hey hey hey hey hey hey hey who gon pray for me take my pain for me save my soul for me cause im alone you see if im gon die for you if im gon kill for you then i spilled this blood for you hey just in case my faith go ill live by my own law ill live by my own law ill live by my own just in case my faith go ill live by my own law ill live by my own law ill live by my own ,Black Panther The Album Music From And Inspired By,album,"Independent, Universal",hip-hop/rap,2,2018,0,"['The Weeknd', 'Kendrick Lamar']",group_male,93.5,98,17355433.5,20224071,37.19354838709677,12.63391676670544,77.0,"[0, 0]",31,"CA, US",2,1,4,0.0762,0.735,0.677,2.17e-05,0.111,-4.979,0.093,0.188,100.584
