playlist,track_id,name,duration_ms,song_popularity,explicit_lyrics,markets,name_length,lyrics,album,album_type,record_company,genres,month,year,holiday_effect,artist,solo_group,artist_popularity_mean,artist_popularity_max,followers_mean,followers_max,GT_mean_value,GT_std_value,GT_range_value,peak,age,country_code,key,mode,time_signature,acousticness,danceability,energy,instrumentalness,liveness,loudness,speechiness,valence,tempo
top_2018,4e4fqjx0Izh4svvTef1z7e,Meant to Be (feat. Florida Georgia Line),164205,72,False,"['AD', 'AE', 'AR', 'AT', 'AU', 'BE', 'BG', 'BH', 'BO', 'BR', 'CA', 'CH', 'CL', 'CO', 'CR', 'CY', 'CZ', 'DE', 'DK', 'DO', 'DZ', 'EC', 'EE', 'EG', 'ES', 'FI', 'FR', 'GB', 'GR', 'GT', 'HK', 'HN', 'HU', 'ID', 'IE', 'IL', 'IN', 'IS', 'IT', 'JO', 'JP', 'KW', 'LB', 'LI', 'LT', 'LU', 'LV', 'MA', 'MC', 'MT', 'MX', 'MY', 'NI', 'NL', 'NO', 'NZ', 'OM', 'PA', 'PE', 'PH', 'PL', 'PS', 'PT', 'PY', 'QA', 'RO', 'SA', 'SE', 'SG', 'SK', 'SV', 'TH', 'TN', 'TR', 'TW', 'US', 'UY', 'VN', 'ZA']",11, baby lay on back and relax kick your pretty feet up on my dash no need to go nowhere fast lets enjoy right here where we at who knows where this road is supposed to lead we got nothing but time as long as youre right here next to me everythings gonna be alright if its meant to be itll be itll be baby just let it be if its meant to be itll be itll be baby just let it be so wont you ride with me ride with me see where this thing goes if its meant to be itll be itll be baby if its meant to be i dont mean to be so uptight but my hearts been hurt a couple times by a couple guys that didnt treat me right i aint gon lie aint gon lie cause im tired of the fake love show me what youre made of boy make me believe whoa hold up girl dont you know youre beautiful and its easy to see if its meant to be itll be itll be baby just let it be if its meant to be itll be itll be baby just let it be so wont you ride with me ride with me see where this thing goes if its meant to be itll be itll be baby if its meant to be so cmon ride with me ride with me see where this thing goes so cmon ride with me ride with me baby if its meant to be maybe we do maybe we dont maybe we will maybe we wont but if its meant to be itll be itll be baby just let it be if its meant to be itll be itll be baby just let it be so wont you ride with me ride with me see where this thing goes if its meant to be itll be itll be baby if its meant to be if its meant to be itll be itll be baby if its meant to be if its meant to be itll be itll be baby if its meant to be hmm ,Expectations,album,Warner,pop,6,2018,1,"['Bebe Rexha', 'Florida Georgia Line']",group_mixed,83.5,85,4372940.0,5055864,28.64516129032258,11.620201992105226,84.0,"[0, 0]",32,US,10,1,4,0.0476,0.642,0.772,0.0,0.0646,-6.61,0.0848,0.589,153.995
top_2018,7m9OqQk4RVRkw9JJdeAw96,Jocelyn Flores,119133,88,True,"['AD', 'AE', 'AR', 'AT', 'AU', 'BE', 'BG', 'BH', 'BO', 'BR', 'CA', 'CH', 'CL', 'CO', 'CR', 'CY', 'CZ', 'DE', 'DK', 'DO', 'DZ', 'EC', 'EE', 'EG', 'ES', 'FI', 'FR', 'GB', 'GR', 'GT', 'HK', 'HN', 'HU', 'ID', 'IE', 'IL', 'IN', 'IS', 'IT', 'JO', 'JP', 'KW', 'LB', 'LI', 'LT', 'LU', 'LV', 'MA', 'MC', 'MT', 'MX', 'MY', 'NI', 'NL', 'NO', 'NZ', 'OM', 'PA', 'PE', 'PH', 'PL', 'PS', 'PT', 'PY', 'QA', 'RO', 'SA', 'SE', 'SG', 'SK', 'SV', 'TH', 'TN', 'TR', 'TW', 'US', 'UY', 'VN', 'ZA']",14, i know you so well so well i mean i can do anything he can ive been pretty i know youre somewhere somewhere ive been trapped in my mind girl just holding on i dont wanna pretend were something were nothing ive been stuck thinking bout her i cant hold on im in pain wanna put ten shots in my brain ive been trippin bout some things cant change suicidal same time im tame picture this in bed get a phone call girl that you fucked with killed herself that was this summer when nobody helped and ever since then man i hate myself wanna fuckin end it pessimistic all wanna see me with no pot to piss in but niggas been excited bout the grave im diggin havin conversations bout my haste decisions fuckin sickenin at the same time memories surface through the grapevine bout my uncle playin with a slip knot posttraumatic stress got me fucked up been fucked up since the couple months they had a nigga locked up ill be feelin pain ill be feelin pain just to hold on and i dont feel the same im so numb ill be feelin pain ill be feelin pain just to hold on and i dont feel the same im so numb i know you so well i mean i can do better than he can ive been pretty i know you so well ,17,album,Independent,hip-hop/rap,8,2017,1,['XXXTENTACION'],solo_male,93.0,93,19252805.0,19252805,19.161290322580644,12.080608178777442,89.0,[0],22,US,0,0,4,0.469,0.872,0.391,4.13e-06,0.297,-9.144,0.242,0.437,134.021
top_2018,0tgVpDi06FyKpA1z0VMD4v,Perfect,263400,87,False,"['AD', 'AE', 'AR', 'AT', 'AU', 'BE', 'BG', 'BH', 'BO', 'BR', 'CA', 'CH', 'CL', 'CO', 'CR', 'CY', 'CZ', 'DE', 'DK', 'DO', 'DZ', 'EC', 'EE', 'EG', 'ES', 'FI', 'FR', 'GB', 'GR', 'GT', 'HK', 'HN', 'HU', 'ID', 'IE', 'IL', 'IN', 'IS', 'IT', 'JO', 'JP', 'KW', 'LB', 'LI', 'LT', 'LU', 'LV', 'MA', 'MC', 'MT', 'MX', 'MY', 'NI', 'NL', 'NO', 'NZ', 'OM', 'PA', 'PE', 'PH', 'PL', 'PS', 'PT', 'PY', 'QA', 'RO', 'SA', 'SE', 'SG', 'SK', 'SV', 'TH', 'TN', 'TR', 'TW', 'US', 'UY', 'VN', 'ZA']",7, i found a love for me oh darling just dive right in and follow my lead well i found a girl beautiful and sweet oh i never knew you were the someone waiting for me cause we were just kids when we fell in love not knowing what it was i will not give you up this time but darling just kiss me slow your heart is all i own and in your eyes youre holding mine baby im dancing in the dark with you between my arms barefoot on the grass listening to our favourite song when you said you looked a mess i whispered underneath my breath but you heard it darling you look perfect tonight well i found a woman stronger than anyone i know she shares my dreams i hope that someday ill share her home i found a love to carry more than just my secrets to carry love to carry children of our own we are still kids but were so in love fighting against all odds i know well be alright this time darling just hold my hand be my girl ill be your man i see my future in your eyes baby im dancing in the dark with you between my arms barefoot on the grass listening to our favorite song when i saw you in that dress looking so beautiful i dont deserve this darling you look perfect tonight  baby im dancing in the dark with you between my arms barefoot on the grass listening to our favorite song i have faith in what i see now i know i have met an angel in person and she looks perfect i dont deserve this you look perfect tonight ,÷ (Deluxe),album,Warner,pop,3,2017,0,['Ed Sheeran'],solo_male,94.0,94,62941064.0,62941064,25.387096774193548,20.963753531556254,96.0,[0],29,GB,8,1,3,0.163,0.599,0.448,0.0,0.106,-6.312,0.0232,0.168,95.05
top_2018,5IaHrVsrferBYDm0bDyABy,Taste (feat. Offset),232959,81,True,"['AD', 'AE', 'AR', 'AT', 'AU', 'BE', 'BG', 'BH', 'BO', 'BR', 'CA', 'CH', 'CL', 'CO', 'CR', 'CY', 'CZ', 'DE', 'DK', 'DO', 'DZ', 'EC', 'EE', 'EG', 'ES', 'FI', 'FR', 'GB', 'GR', 'GT', 'HK', 'HN', 'HU', 'ID', 'IE', 'IL', 'IN', 'IS', 'IT', 'JO', 'JP', 'KW', 'LB', 'LI', 'LT', 'LU', 'LV', 'MA', 'MC', 'MT', 'MX', 'MY', 'NI', 'NL', 'NO', 'NZ', 'OM', 'PA', 'PE', 'PH', 'PL', 'PS', 'PT', 'PY', 'QA', 'RO', 'SA', 'SE', 'SG', 'SK', 'SV', 'TH', 'TN', 'TR', 'TW', 'US', 'UY', 'VN', 'ZA']",5, da hah slide on it pimp game with my pinky ring lotta gang lotta bitches and a icy chain why you claim that you rich thats a false claim i be straight to the whip no baggage claim whole lotta styles cant even pronounce the name you aint got no style see you on my instagram i be rockin it like its fresh out the pan only when im takin pics im the middleman walk talk it like a boss i just lift a hand three million cash call me rain man money like a shower thats my rain dance and we all in black like its gangland say the wrong words you be hangman watch me stick to your bitch like a spray tan aw mr whatkindofcarhein and the city love my name nigga i aint gotta say it she can get a taste she can get a taste fuck what a nigga say its all the same like marykate she can get a taste let you get a taste do you love the taste yeah thats cool but he aint like me lotta girls like me niggas wanna fight me nigga get your ass checked like a fuckin nike me not icy thats unlikely and she gon suck me like a fuckin hic aw chains on the neck for the whole team and i feel like gucci with the ice cream and my bitch want the fenty not the maybelline im the black jb the way these bitches scream make these bitches scream ah pretty little thing like my nigga ae say yadadadamean she can get a taste she can get a taste fuck what a nigga say its all the same like marykate she can get a taste let you get a taste do you love the taste yeah thats cool yeah ima put the drip on the plate yeah diamond ice glacier niggas imitate ayy ayy feed me grapes maybach with the drake slow pace in the wraith got this shit from bae diamonds up to par the cookie hittin hard the rari sit in park on addy on mars shotgun shells we gon always hit the target popcorn big shell poppin out the cartridge 3400 nawfside charles barkley 488 ferrari make her get on top of me and ride me like a harley she wanna keep me company and never wan depart me depart me yeah fishtail in the parking lot i dont kick it with these niggas cause they talk about ya yeah and i got the fire dont make me spark it out ya yeah keep it in my back pocket like its a wallet like the way she suck it suck it like a jolly stack it up and put it with the whole project and she got that patek on water moccasin im rich in real life i get that profit copy she can get a taste let you get a taste do you love the taste yeah thats cool but he aint like me la you can get a taste miami you can get a taste oakland you can get a taste new york do you love the taste chitown you can get a taste houston you can get a taste ayy portland you can get a taste overseas let them bitches taste she can get a taste she can get a taste do you love the taste worldwide they gon get a taste ,Taste (feat. Offset),single,Independent,hip-hop/rap,5,2018,1,"['Tyga', 'Offset']",group_male,87.5,90,3591869.0,5610679,46.55913978494624,12.150082368729247,71.0,"[0, 2]",29,US,0,1,4,0.0236,0.884,0.559,0.0,0.101,-7.442,0.12,0.342,97.994
top_2018,6kPJZM97LwdG9QIsT7khp6,Solo (feat. Demi Lovato),222653,79,False,"['AD', 'AE', 'AR', 'AT', 'AU', 'BE', 'BG', 'BH', 'BO', 'BR', 'CA', 'CH', 'CL', 'CO', 'CR', 'CY', 'CZ', 'DE', 'DK', 'DO', 'DZ', 'EC', 'EE', 'EG', 'ES', 'FI', 'FR', 'GB', 'GR', 'GT', 'HK', 'HN', 'HU', 'ID', 'IE', 'IL', 'IN', 'IS', 'IT', 'JO', 'JP', 'KW', 'LB', 'LI', 'LT', 'LU', 'LV', 'MA', 'MC', 'MT', 'MX', 'MY', 'NI', 'NL', 'NO', 'NZ', 'OM', 'PA', 'PE', 'PH', 'PL', 'PS', 'PT', 'PY', 'QA', 'RO', 'SA', 'SE', 'SG', 'SK', 'SV', 'TH', 'TN', 'TR', 'TW', 'US', 'UY', 'VN', 'ZA']",4, its solo solo everybody its solo eeeeverybody its solo solo everybody woop woop woop woop woop woop woop i never meant to leave you hurtin i never meant to do the worst thing not to you cause every time i read your message i wish i wasnt one of your exes now im the fool since youve been gone ive been dancing on my own theres boys up in my zone but they cant turn me on cause baby youre the only one im coming for i cant take no more no more no more i wanna fwoop woop woop but im broken hearted crcrcry but i like to party tttouch but i got nobody here on my own i wanna fwoop woop woop but im broken hearted crcrcry since the day we parted tttouch but i got nobody so i do it solo its solo solo everybody its solo eeeeverybody its solo solo everybody its solo solo everybody its solo eeeeverybody its solo solo everybody every single night i lose it i cant even hear the music without you oh yeah yeah yeah try to stop myself from calling but i really wanna know if youre with someone new since youve been gone ive been dancing on my own theres boys up in my zone but they cant turn me on cause baby youre the only one im coming for i cant take no more no more no more i wanna fwoop woop woop but im broken hearted crcrcry but i like to party tttouch but i got nobody here on my own i wanna fwoop woop woop but im broken hearted crcrcry since the day we parted tttouch but i got nobody so i do it solo its solo solo everybody its solo eeeeverybody its solo solo everybody its solo solo everybody its solo eeeeverybody its solo solo everybody cant do it solo i wanna fwoop woop woop but im broken hearted crcrcry but i like to party tttouch but i got nobody here on my own i wanna fwoop woop woop but im broken hearted crcrcry since the day we parted tttouch but i got nobody so i do it solo its solo solo everybody its solo eeeeverybody its solo solo everybody its solo solo everybody its solo eeeeverybody its solo solo everybody so i do it solo ,Solo (feat. Demi Lovato),single,Warner,dance,5,2018,1,"['Clean Bandit', 'Demi Lovato']",group_mixed,83.0,87,10422901.5,17066542,55.38172043010753,14.425072779131106,70.0,"[1, 0]",31,"GB, US",11,0,4,0.0441,0.737,0.636,6.66e-05,0.35,-4.546,0.0437,0.565,105.005
top_2018,75ZvA4QfFiZvzhj2xkaWAh,I Fall Apart,223346,85,True,"['AD', 'AE', 'AR', 'AT', 'AU', 'BE', 'BG', 'BH', 'BO', 'BR', 'CA', 'CH', 'CL', 'CO', 'CR', 'CY', 'CZ', 'DE', 'DK', 'DO', 'DZ', 'EC', 'EE', 'EG', 'ES', 'FI', 'FR', 'GB', 'GR', 'GT', 'HK', 'HN', 'HU', 'ID', 'IE', 'IL', 'IN', 'IS', 'IT', 'JO', 'JP', 'KW', 'LB', 'LI', 'LT', 'LU', 'LV', 'MA', 'MC', 'MT', 'MX', 'MY', 'NI', 'NL', 'NO', 'NZ', 'OM', 'PA', 'PE', 'PH', 'PL', 'PS', 'PT', 'PY', 'QA', 'RO', 'SA', 'SE', 'SG', 'SK', 'SV', 'TH', 'TN', 'TR', 'TW', 'US', 'UY', 'VN', 'ZA']",12, ooh i fall apart ooh yeah mmm yeah she told me that im not enough and she left me with a broken heart she fooled me twice and its all my fault she cut too deep now she left me scarred now theres so many thoughts goin through my brain and now im takin these shots like its novocaine yeah ooh i fall apart down to my core ooh i fall apart down to my core ooh didnt know it before surprised when you caught me off guard all this damn jewelry i bought you was my shorty i thought never caught a feelin this hard harder than the liquor i pour tell me you dont want me no more but i cant let go everybody told me so feelin like i sold my soul devil in the form of a whore devil in the form of a whore you said it no you said it no you said that shit wed be together oh ooh i fall apart down to my core ooh i fall apart down to my core ooh didnt know it before surprised when you caught me off guard all this damn jewelry i bought you was my shorty i thought ice keep pourin and the drink keep flowin try to brush it off but it keep on goin covered in scars and i cant help showin whippin in the foreign and the tears keep rollin ice keep droppin and the drink keep flowin try to brush it off but it keep on goin all these scars cant help from showin whippin in the foreign and the tears keep blowin yeah ooh i fall apart down to my core ooh i fall apart down to my core ooh didnt know it before surprised when you caught me off guard all this damn jewelry i bought you was my shorty i thought ,Stoney (Deluxe),album,Universal,hip-hop/rap,12,2016,0,['Post Malone'],solo_male,95.0,95,24646235.0,24646235,19.78494623655914,14.246166122219012,90.0,[1],24,US,8,0,4,0.0689,0.556,0.538,0.0,0.196,-5.408,0.0382,0.291,143.95
top_2018,63SevszngYpZOwf63o61K4,Nevermind,156600,79,False,"['AD', 'AE', 'AR', 'AT', 'AU', 'BE', 'BG', 'BH', 'BO', 'BR', 'CA', 'CH', 'CL', 'CO', 'CR', 'CY', 'CZ', 'DE', 'DK', 'DO', 'EC', 'EE', 'ES', 'FI', 'FR', 'GB', 'GR', 'GT', 'HK', 'HN', 'HU', 'ID', 'IE', 'IN', 'IS', 'IT', 'JO', 'LB', 'LI', 'LT', 'LU', 'LV', 'MC', 'MT', 'MX', 'MY', 'NI', 'NL', 'NO', 'NZ', 'OM', 'PA', 'PE', 'PH', 'PL', 'PT', 'PY', 'RO', 'SA', 'SE', 'SG', 'SK', 'SV', 'TH', 'TR', 'TW', 'US', 'UY', 'VN', 'ZA']",9, what if i left and it made no sense and you tell your friends and they hold your hands baby never mind never mind what if i left and it made no sense and you tell your friends and they hold your hands baby never mind never mind alright im ready now ready now i aint gonna i aint gonna fall back down no alright ill take it on take it on me take it on me hmm baby all i i ever ask ever ask are you gonna are you gonna be my lover tonight and take it with take it with me take it with me what if i left and it made no sense and you tell your friends and they hold your hands baby never mind never mind never mind never mind what if i left and it made no sense and you tell your friends and they hold your hands baby never mind never mind never mind never mind what if i left and it made no sense and you tell your friends and they hold your hands baby never mind never mind never mind never mind what if i left and it made no sense and you tell your friends and they hold your hands baby never mind never mind never mind never mind alright im ready now ready now i aint gonna i aint gonna stop right now no alright ill take it on take it on me take it on me ooh baby all i i ever ask ever ask is do you wanna do you wanna see my fire tonight and take it with take it with me take it with me hmm baby what if i left and it made no sense and you tell your friends and they hold your hands baby never mind never mind never mind never mind what if i left and it made no sense and you tell your friends and they hold your hands baby never mind never mind never mind never mind what if i left and it made no sense and you tell your friends and they hold your hands baby never mind never mind never mind never mind what if i left and it made no sense and you tell your friends and they hold your hands baby never mind never mind never mind never mind ,Nevermind,single,Warner,pop,6,2017,1,['Dennis Lloyd'],solo_male,73.0,73,407795.0,407795,19.107526881720432,16.41742338359874,100.0,[0],26,IL,5,0,4,0.159,0.6,0.688,1.29e-05,0.409,-8.339,0.201,0.0793,99.977
top_2018,2hl6q70unbviGo3g1R7uFx,Échame La Culpa,173720,68,False,"['AD', 'AE', 'AR', 'AT', 'AU', 'BE', 'BG', 'BH', 'BO', 'BR', 'CA', 'CH', 'CL', 'CO', 'CR', 'CY', 'CZ', 'DE', 'DK', 'DO', 'DZ', 'EC', 'EE', 'EG', 'ES', 'FI', 'FR', 'GB', 'GR', 'GT', 'HK', 'HN', 'HU', 'ID', 'IE', 'IL', 'IN', 'IS', 'IT', 'JO', 'JP', 'KW', 'LB', 'LI', 'LT', 'LU', 'LV', 'MA', 'MC', 'MT', 'MX', 'MY', 'NI', 'NL', 'NO', 'NZ', 'OM', 'PA', 'PE', 'PH', 'PL', 'PS', 'PT', 'PY', 'QA', 'RO', 'SA', 'SE', 'SG', 'SK', 'SV', 'TH', 'TN', 'TR', 'TW', 'US', 'UY', 'VN', 'ZA']",15,  hey fonsi oh no qué pasa demi mmm hmhm ey yeah tengo en esta historia algo que confesar ya entendí muy bien qué fue lo que pasó y aunque duela tanto tengo que aceptar que tú no eres la mala que el malo soy yo no me conociste nunca de verdad ya se fue la magia que te enamoró y es que no quisiera estar en tu lugar porque tu error sólo fue conocerme no eres tú no eres tú no eres tú soy yo no te quiero hacer sufrir es mejor olvidar y dejarlo así échame la culpa no eres tú no eres tú no eres tú soy yo no te quiero hacer sufrir es mejor olvidar y dejarlo así échame la culpa okay i dont really really wanna fight anymore i dont really really want to fake it no more play me like the beatles baby just let it be so come on put the blame on me yeah i dont really really wanna fight anymore i dont really really want to fake it no more play me like the beatles baby just let it be so come on put the blame on me no eres tú no eres tú no eres tú soy yo no te quiero hacer sufrir es mejor olvidar y dejarlo así échame la culpa no eres tú no eres tú no eres tú soy yo no te quiero hacer sufrir es mejor olvidar y dejarlo así échame la culpa solamente te falta un beso solamente te falta un beso ese beso que siempre te prometí échame la culpa solamente te falta un beso solamente te falta un beso ese beso que siempre te prometí échame la culpa okay i dont really really wanna fight anymore i dont really really want to fake it no more play me like the beatles baby just let it be so come on put the blame on me yeah i dont really really wanna fight anymore i dont really really want to fake it no more play me like the beatles baby just let it be so come on put the blame on me no eres tú no eres tú no eres tú soy yo no te quiero hacer sufrir es mejor olvidar y dejarlo así échame la culpa no eres tú no eres tú no eres tú soy yo no te quiero hacer sufrir es mejor olvidar y dejarlo así échame la culpa solamente te falta un beso solamente te falta un beso ese beso que siempre te prometí échame la culpa solamente te falta un beso solamente te falta un beso ese beso que siempre te prometí échame la culpa ,Échame La Culpa,single,Universal,latin/reggaeton,11,2017,0,"['Luis Fonsi', 'Demi Lovato']",group_mixed,83.5,87,12716408.5,17066542,34.876344086021504,13.121717746071756,80.0,"[1, 0]",34,"PR, US",0,1,4,0.0376,0.733,0.892,0.0,0.137,-3.641,0.0417,0.675,95.989
top_2018,0d2iYfpKoM0QCKvcLCkBao,Eastside (with Halsey & Khalid),173799,84,False,"['AD', 'AE', 'AR', 'AT', 'AU', 'BE', 'BG', 'BH', 'BO', 'BR', 'CA', 'CH', 'CL', 'CO', 'CR', 'CY', 'CZ', 'DE', 'DK', 'DO', 'DZ', 'EC', 'EE', 'EG', 'ES', 'FI', 'FR', 'GB', 'GR', 'GT', 'HK', 'HN', 'HU', 'ID', 'IE', 'IL', 'IN', 'IS', 'IT', 'JO', 'JP', 'KW', 'LB', 'LI', 'LT', 'LU', 'LV', 'MA', 'MC', 'MT', 'MX', 'MY', 'NI', 'NL', 'NO', 'NZ', 'OM', 'PA', 'PE', 'PH', 'PL', 'PS', 'PT', 'PY', 'QA', 'RO', 'SA', 'SE', 'SG', 'SK', 'SV', 'TH', 'TN', 'TR', 'TW', 'US', 'UY', 'VN', 'ZA']",8, uh yeah yeah when i was young i fell in love we used to hold hands man that was enough then we grew up started to touch used to kiss underneath the light on the back of the bus i know your daddy didnt like me much and he didnt believe me when i said you were the one oh every day she found a way out of the window to sneak out late she used to meet me on the eastside in the city where the sun dont set and every day you know that wed ride through the backstreets in a blue corvette baby you know i just wanna leave tonight we can go anywhere we want drive down to the coast jump in the sea just take my hand and come with me yeah we can do anything if we put our minds to it take your old life then you put a line through it my love is yours if youre willing to take it give me your heart cause i aint gonna break it so come away starting today start a new life together in a different place we know that love is how all these ideas came to be so baby run away with me 17 and we got a dream to have a family a house and everything in between and then oh suddenly we turned 23 and now we got pressure for taking our life more seriously we got our deadend jobs and got bills to pay our old friends are now our enemies and now i im thinking back to when i was young back to the day when i was falling in love he used to meet me on the eastside in the city where the sun dont set and every day you know where wed ride through the backstreets in a blue corvette and baby you know i just wanna leave tonight we can go anywhere we want drive down to the coast jump in the sea just take my hand and come with me singing we can do anything if we put our minds to it take your old life then you put a line through it my love is yours if youre willing to take it give me your heart cause i aint gonna break it so come away starting today to start a new life together in a different place we know that love is how all these ideas came to be so baby run away with me run away now run away now run away now run away now run away now run away now he used to meet me on the eastside she used to meet me on the eastside he used to meet me on the eastside she used to meet me on the eastside in the city where the sun dont set ,Eastside (with Halsey & Khalid),single,Universal,pop,7,2018,1,"['benny blanco', 'Halsey', 'Khalid']",group_mixed,87.66666666666667,93,7397414.333333333,11295331,28.093189964157705,12.821863310408958,83.33333333333333,"[1, 0, 0]",26,US,6,0,4,0.555,0.56,0.68,0.0,0.116,-7.648,0.321,0.319,89.391
