playlist,track_id,name,duration_ms,song_popularity,explicit_lyrics,markets,name_length,lyrics,album,album_type,record_company,genres,month,year,holiday_effect,artist,solo_group,artist_popularity_mean,artist_popularity_max,followers_mean,followers_max,GT_mean_value,GT_std_value,GT_range_value,peak,age,country_code,key,mode,time_signature,acousticness,danceability,energy,instrumentalness,liveness,loudness,speechiness,valence,tempo
top_2019,6v3KW9xbzN5yKLt9YKDYA2,Señorita,190799,85,False,"['AD', 'AE', 'AR', 'AT', 'AU', 'BE', 'BG', 'BH', 'BO', 'BR', 'CA', 'CH', 'CL', 'CO', 'CR', 'CY', 'CZ', 'DE', 'DK', 'DO', 'DZ', 'EC', 'EE', 'EG', 'ES', 'FI', 'FR', 'GB', 'GR', 'GT', 'HK', 'HN', 'HU', 'ID', 'IE', 'IL', 'IN', 'IS', 'IT', 'JO', 'JP', 'KW', 'LB', 'LI', 'LT', 'LU', 'LV', 'MA', 'MC', 'MT', 'MX', 'MY', 'NI', 'NL', 'NO', 'NZ', 'OM', 'PA', 'PE', 'PH', 'PL', 'PS', 'PT', 'PY', 'QA', 'RO', 'SA', 'SE', 'SG', 'SK', 'SV', 'TH', 'TN', 'TR', 'TW', 'US', 'UY', 'VN', 'ZA']",8, i love it when you call me señorita i wish i could pretend i didnt need ya but every touch is oohlalala its true lalala ooh i should be runnin ooh you keep me coming for ya land in miami the air was hot from summer rain sweat drippin off me before i even knew her name lalala it felt like oohlalala yeah no sapphire moonlight we danced for hours in the sand tequila sunrise her body fit right in my hands lalala it felt like oohlalala yeah i love it when you call me señorita i wish i could pretend i didnt need ya but every touch is oohlalala its true lalala ooh i should be runnin ooh you know i love it when you call me señorita i wish it wasnt so damn hard to leave ya but every touch is oohlalala its true lalala ooh i should be runnin ooh you keep me coming for ya locked in the hotel theres just some things that never change you say were just friends but friends dont know the way you taste lalala cause you know its been a long time coming dont ya let me fall oh ooh when your lips undress me hooked on your tongue ooh love your kiss is deadly dont stop i love it when you call me señorita i wish i could pretend i didnt need ya but every touch is oohlalala its true lalala ooh i should be runnin ooh you know i love it when you call me señorita i wish it wasnt so damn hard to leave ya but every touch is oohlalala its true lalala ooh i should be runnin ooh you keep me coming for ya all along ive been coming for ya and i hope it meant something to you call my name ill be coming for ya coming for ya for ya for ya for ya ooh i should be runnin ooh you keep me coming for ya ,Shawn Mendes (Deluxe),album,Universal,pop,6,2019,1,"['Shawn Mendes', 'Camila Cabello']",group_mixed,89.5,90,21010809.5,25977484,18.67741935483871,15.852815882700193,90.5,"[2, 2]",22,"CA, US",9,0,4,0.0392,0.759,0.548,0.0,0.0828,-6.049,0.029,0.749,116.967
top_2019,2Fxmhks0bxGSBdJ92vM42m,bad guy,194087,93,False,"['AD', 'AE', 'AR', 'AT', 'AU', 'BE', 'BG', 'BH', 'BO', 'BR', 'CA', 'CH', 'CL', 'CO', 'CR', 'CY', 'CZ', 'DE', 'DK', 'DO', 'DZ', 'EC', 'EE', 'EG', 'ES', 'FI', 'FR', 'GB', 'GR', 'GT', 'HK', 'HN', 'HU', 'ID', 'IE', 'IL', 'IN', 'IS', 'IT', 'JO', 'JP', 'KW', 'LB', 'LI', 'LT', 'LU', 'LV', 'MA', 'MC', 'MT', 'MX', 'MY', 'NI', 'NL', 'NO', 'NZ', 'OM', 'PA', 'PE', 'PH', 'PL', 'PS', 'PT', 'PY', 'QA', 'RO', 'SA', 'SE', 'SG', 'SK', 'SV', 'TH', 'TN', 'TR', 'TW', 'US', 'UY', 'VN', 'ZA']",7, white shirt now red my bloody nose sleepin youre on your tippy toes creepin around like no one knows think youre so criminal bruises on both my knees for you dont say thank you or please i do what i want when im wanting to my soul so cynical so youre a tough guy like it really rough guy just cant get enough guy chest always so puffed guy im that bad type make your mama sad type make your girlfriend mad tight might seduce your dad type im the bad guy duh im the bad guy i like it when you take control even if you know that you dont own me ill let you play the role ill be your animal my mommy likes to sing along with me but she wont sing this song if she reads all the lyrics shell pity the men i know so youre a tough guy like it really rough guy just cant get enough guy chest always so puffed guy im that bad type make your mama sad type make your girlfriend mad tight might seduce your dad type im the bad guy duh im the bad guy duh im only good at bein bad bad i like when you get mad i guess im pretty glad that youre alone you said shes scared of me i mean i dont see what she sees but maybe its cause im wearing your cologne im a bad guy im im a bad guy bad guy bad guy im a bad ,"WHEN WE ALL FALL ASLEEP, WHERE DO WE GO?",album,Universal,pop,3,2019,0,['Billie Eilish'],solo_female,95.0,95,24861338.0,24861338,28.096774193548388,18.319070911110185,88.0,[1],18,US,7,1,4,0.328,0.701,0.425,0.13,0.1,-10.965,0.375,0.562,135.128
top_2019,0RiRZpuVRbi7oqRdSMwhQY,Sunflower - Spider-Man: Into the Spider-Verse,157560,85,False,"['AD', 'AE', 'AR', 'AT', 'AU', 'BE', 'BG', 'BH', 'BO', 'BR', 'CA', 'CH', 'CL', 'CO', 'CR', 'CY', 'CZ', 'DE', 'DK', 'DO', 'DZ', 'EC', 'EE', 'EG', 'ES', 'FI', 'FR', 'GB', 'GR', 'GT', 'HK', 'HN', 'HU', 'ID', 'IE', 'IL', 'IN', 'IS', 'IT', 'JO', 'JP', 'KW', 'LB', 'LI', 'LT', 'LU', 'LV', 'MA', 'MC', 'MT', 'MX', 'MY', 'NI', 'NL', 'NO', 'NZ', 'OM', 'PA', 'PE', 'PH', 'PL', 'PS', 'PT', 'PY', 'QA', 'RO', 'SA', 'SE', 'SG', 'SK', 'SV', 'TH', 'TN', 'TR', 'TW', 'US', 'UY', 'VN', 'ZA']",9,ayy ayy ayy ayy ooh ooh ooh ooh ayy ayy ooh ooh ooh ooh needless to say i keep in check she was a badbad nevertheless callin it quits now baby im a wreck crash at my place baby youre a wreck needless to say im keeping in check she was a badbad nevertheless callin it quits now baby im a wreck crash at my place baby youre a wreck thinkin in a bad way losin your grip screamin at my face baby dont trip someone took a big l dont know how that felt lookin at you sideways party on tilt oohooh some things you just cant refuse she wanna ride me like a cruise and im not tryna lose then youre left in the dust unless i stuck by ya youre a sunflower i think your love would be too much or youll be left in the dust unless i stuck by ya youre the sunflower youre the sunflower every time im leavin on ya you dont make it easy no wish i could be there for ya give me a reason to oh every time im walkin out i can hear you tellin me to turn around fightin for my trust and you wont back down even if we gotta risk it all right now oh i know youre scared of the unknown you dont wanna be alone i know i always come and go but its out of my control and youll be left in the dust unless i stuck by ya youre the sunflower i think your love would be too much or youll be left in the dust unless i stuck by ya youre the sunflower youre the sunflower,Hollywood's Bleeding,album,Universal,hip-hop/rap,9,2019,0,"['Post Malone', 'Swae Lee']",group_male,90.0,95,12668548.5,24646235,25.284946236559136,13.5630639854075,89.0,"[1, 0]",25,US,2,1,4,0.533,0.755,0.522,0.0,0.0685,-4.368,0.0575,0.925,89.96
top_2019,6ocbgoVGwYJhOv1GgI9NsF,7 rings,178626,88,True,"['AD', 'AE', 'AR', 'AT', 'AU', 'BE', 'BG', 'BH', 'BO', 'BR', 'CA', 'CH', 'CL', 'CO', 'CR', 'CY', 'CZ', 'DE', 'DK', 'DO', 'DZ', 'EC', 'EE', 'EG', 'ES', 'FI', 'FR', 'GB', 'GR', 'GT', 'HK', 'HN', 'HU', 'ID', 'IE', 'IL', 'IN', 'IS', 'IT', 'JO', 'JP', 'KW', 'LB', 'LI', 'LT', 'LU', 'LV', 'MA', 'MC', 'MT', 'MX', 'MY', 'NI', 'NL', 'NO', 'NZ', 'OM', 'PA', 'PE', 'PH', 'PL', 'PS', 'PT', 'PY', 'QA', 'RO', 'SA', 'SE', 'SG', 'SK', 'SV', 'TH', 'TN', 'TR', 'TW', 'US', 'UY', 'VN', 'ZA']",7, yeah breakfast at tiffanys and bottles of bubbles girls with tattoos who like getting in trouble lashes and diamonds atm machines buy myself all of my favorite things been through some bad shit i should be a sad bitch who woulda thought itd turn me to a savage rather be tied up with calls and not strings write my own checks like i write what i sing yeah my wrist stop watchin my neck is flossy make big deposits my gloss is poppin you like my hair gee thanks just bought it i see it i like it i want it i got it i want it i got it i want it i got it i want it i got it i want it i got it you like my hair gee thanks just bought it i see it i like it i want it i got it wearing a ring but aint gon be no mrs bought matching diamonds for six of my bitches id rather spoil all my friends with my riches think retail therapy my new addiction whoever said money cant solve your problems must not have had enough money to solve em they say which one i say nah i want all of em happiness is the same price as redbottoms my smile is beamin my skin is gleamin the way it shine i know youve seen it i bought a crib just for the closet both his and hers i want it i got it yeah i want it i got it i want it i got it i want it i got it i want it i got it you like my hair gee thanks just bought it i see it i like it i want it i got it yeah my receipts be lookin like phone numbers if it aint money then wrong number black card is my business card the way it be settin the tone for me i dont mean to brag but i be like put it in the bag yeah when you see them racks they stacked up like my ass yeah shoot go from the store to the booth make it all back in one loop gimme the loot never mind i got the juice nothing but net when we shoot look at my neck look at my jet aint got enough money to pay me respect aint no budget when im on the set if i like it then thats what i get yeah i want it i got it i want it i got it i want it i got it i want it i got it you like my hair gee thanks just bought it i see it i like it i want it i got it ,"thank u, next",album,Universal,pop,2,2019,0,['Ariana Grande'],solo_female,92.0,92,45042400.0,45042400,39.27956989247312,15.49850314749772,79.0,[1],26,US,1,0,4,0.592,0.778,0.317,0.0,0.0881,-10.732,0.334,0.327,140.048
top_2019,2YpeDb67231RjR0MgVLzsG,Old Town Road - Remix,157066,87,False,"['AD', 'AE', 'AR', 'AT', 'AU', 'BE', 'BG', 'BH', 'BO', 'BR', 'CA', 'CH', 'CL', 'CO', 'CR', 'CY', 'CZ', 'DE', 'DK', 'DO', 'DZ', 'EC', 'EE', 'EG', 'ES', 'FI', 'FR', 'GB', 'GR', 'GT', 'HK', 'HN', 'HU', 'ID', 'IE', 'IL', 'IN', 'IS', 'IT', 'JO', 'JP', 'KW', 'LB', 'LI', 'LT', 'LU', 'LV', 'MA', 'MC', 'MT', 'MX', 'MY', 'NI', 'NL', 'NO', 'NZ', 'OM', 'PA', 'PE', 'PH', 'PL', 'PS', 'PT', 'PY', 'QA', 'RO', 'SA', 'SE', 'SG', 'SK', 'SV', 'TH', 'TN', 'TR', 'TW', 'US', 'UY', 'VN', 'ZA']",13, oh ohoh oh yeah im gonna take my horse to the old town road im gonna ride til i cant no more im gonna take my horse to the old town road im gonna ride til i cant no more i got the horses in the back horse tack is attached hat is matte black got the boots thats black to match ridin on a horse ha you can whip your porsche i been in the valley you aint been up off that porch now cant nobody tell me nothin you cant tell me nothin cant nobody tell me nothin you cant tell me nothin  cant nobody tell me nothin you cant tell me nothin cant nobody tell me nothin you cant tell me nothin hat down cross town livin like a rockstar spent a lot of money on my brand new guitar babys got a habit diamond rings and fendi sports bras ridin down rodeo in my maserati sports car got no stress ive been through all that im like a marlboro man so i kick on back wish i could roll on back to that old town road i wanna ride til i cant no more yeah im gonna take my horse to the old town road im gonna ride til i cant no more im gonna take my horse to the old town road im gonna ride til i cant no more im gonna take my horse to the old town road im gonna ride til i cant no more im gonna take my horse to the old town road im gonna ride til i cant no more  yeah im gonna take my horse to the old town road im gonna ride til i cant no more im gonna take my horse to the old town road im gonna ride til i cant no more im gonna take my horse to the old town road im gonna ride til i cant no more im gonna take my horse to the old town road im gonna ride til i cant no more ,7 EP,single,Sony,country,6,2019,1,"['Lil Nas X', 'Billy Ray Cyrus']",group_male,79.0,82,1599730.0,3041145,28.758064516129032,15.607458147014853,92.0,"[0, 0]",39,US,6,1,4,0.0533,0.878,0.619,0.0,0.113,-5.56,0.102,0.639,136.041
top_2019,0hVXuCcriWRGvwMV1r5Yn9,I Don't Care (with Justin Bieber),219946,82,False,"['AD', 'AE', 'AR', 'AT', 'AU', 'BE', 'BG', 'BH', 'BO', 'BR', 'CA', 'CH', 'CL', 'CO', 'CR', 'CY', 'CZ', 'DE', 'DK', 'DO', 'DZ', 'EC', 'EE', 'EG', 'ES', 'FI', 'FR', 'GB', 'GR', 'GT', 'HK', 'HN', 'HU', 'ID', 'IE', 'IL', 'IN', 'IS', 'IT', 'JO', 'JP', 'KW', 'LB', 'LI', 'LT', 'LU', 'LV', 'MA', 'MC', 'MT', 'MX', 'MY', 'NI', 'NL', 'NO', 'NZ', 'OM', 'PA', 'PE', 'PH', 'PL', 'PS', 'PT', 'PY', 'QA', 'RO', 'SA', 'SE', 'SG', 'SK', 'SV', 'TH', 'TN', 'TR', 'TW', 'US', 'UY', 'VN', 'ZA']",12, im at a party i dont wanna be at and i dont ever wear a suit and tie yeah wonderin if i could sneak out the back nobodys even lookin me in my eyes then you take my hand finish my drink say shall we dance you know i love ya did i ever tell ya you make it better like that dont think i fit in at this party everyones got so much to say i always feel like im nobody mmm who wants to fit in anyway cause i dont care when im with my baby yeah all the bad things disappear and youre making me feel like maybe i am somebody i can deal with the bad nights when im with my baby yeah ooh ooh ooh ooh ooh ooh cause i dont care as long as you just hold me near you can take me anywhere and youre making me feel like im loved by somebody i can deal with the bad nights when im with my baby yeah ooh ooh ooh ooh ooh ooh we at a party we dont wanna be at tryna talk but we cant hear ourselves read your lips id rather kiss em right back with all these people all around im crippled with anxiety but im told its where im sposed to be you know what its kinda crazy cause i really dont mind when you make it better like that dont think we fit in at this party everyones got so much to say oh yeah yeah when we walked in i said im sorry mmm but now i think that we should stay cause i dont care when im with my baby yeah all the bad things disappear yeah youre making me feel like maybe i am somebody i can deal with the bad nights when im with my baby yeah ooh ooh ooh ooh ooh ooh cause i dont care as long as you just hold me near you can take me anywhere and youre making me feel like im loved by somebody i can deal with the bad nights when im with my baby yeah ooh ooh ooh ooh ooh ooh i dont like nobody but you its like youre the only one here i dont like nobody but you baby i dont care i dont like nobody but you i hate everyone here i dont like nobody but you baby yeah cause i dont care when im with my baby yeah all the bad things disappear and youre making me feel like maybe i am somebody i can deal with the bad nights when im with my baby yeah ooh ooh ooh ooh ooh ooh cause i dont care as long as you just hold me near you can take me anywhere and youre making me feel like im loved by somebody i can deal with the bad nights when im with my baby yeah ooh ooh ooh ooh ooh ooh ,No.6 Collaborations Project,album,Warner,pop,7,2019,1,"['Ed Sheeran', 'Justin Bieber']",group_male,94.5,95,48734124.0,62941064,43.682795698924735,12.915545842683697,72.0,"[1, 0]",27,"CA, GB",6,1,4,0.0912,0.798,0.675,0.0,0.0894,-5.041,0.0442,0.842,101.956
top_2019,7xQAfvXzm3AkraOtGPWIZg,Wow.,149546,87,True,"['AD', 'AE', 'AR', 'AT', 'AU', 'BE', 'BG', 'BH', 'BO', 'BR', 'CA', 'CH', 'CL', 'CO', 'CR', 'CY', 'CZ', 'DE', 'DK', 'DO', 'DZ', 'EC', 'EE', 'EG', 'ES', 'FI', 'FR', 'GB', 'GR', 'GT', 'HK', 'HN', 'HU', 'ID', 'IE', 'IL', 'IN', 'IS', 'IT', 'JO', 'JP', 'KW', 'LB', 'LI', 'LT', 'LU', 'LV', 'MA', 'MC', 'MT', 'MX', 'MY', 'NI', 'NL', 'NO', 'NZ', 'OM', 'PA', 'PE', 'PH', 'PL', 'PS', 'PT', 'PY', 'QA', 'RO', 'SA', 'SE', 'SG', 'SK', 'SV', 'TH', 'TN', 'TR', 'TW', 'US', 'UY', 'VN', 'ZA']",4, said she tired of little money need a big boy pull up 20 inch blades like im lil troy now its everybody flockin need a decoy shawty mixing up the vodka with the lacroix yeah gwagen gwagen gwagen gwagen all the housewives pullin up i got a lot of toys 720s bumpin fall out boy you was talkin shit in the beginning back when i was feelin more forgivin i know it piss you off to see me winnin see the igloo in my mouth when i be grinnin yeah hunnid bands in my pocket its on me hunnid deep when i roll like the army get more bottles these bottles are lonely its a moment when i show up got em sayin wow hunnid bands in my pocket its on me yeah your grandmama probably know me get more bottles these bottles are lonely its a moment when i show up got em sayin wow everywhere i go catch me on the block like im mutombo 750 lambo in the utah snow trunk in the front like that shit dumbo yeah cut the roof off like a niptuck pull up to the house with some big butts turn the kitchen counter to a stripclub me and dre came for the when i got guap all of yall just appeared before i dropped stoney none of yall really cared now they always say congratulations to the kid and this is not a 40 but im pourin out this shit used to have a lot but i got more now made another hit cause i got bored now always goin for it never punt fourth down last call hail mary prescott touchdown ayy hunnid bands in my pocket its on me hunnid deep when i roll like the army get more bottles these bottles are lonely its a moment when i show up got em sayin wow hunnid bands in my pocket its on me yeah your grandmama probably know me get more bottles these bottles are lonely its a moment when i show up got em sayin wow got em sayin wow ayy ayy wow sayin wow wow wow ,Hollywood's Bleeding,album,Universal,hip-hop/rap,9,2019,0,['Post Malone'],solo_male,95.0,95,24646235.0,24646235,29.93548387096774,16.19970910340871,86.0,[1],24,US,11,0,4,0.136,0.829,0.539,1.78e-06,0.103,-7.359,0.208,0.388,99.96
top_2019,7qEHsqek33rTcFNT9PFqLf,Someone You Loved,182160,94,False,"['AD', 'AE', 'AR', 'AT', 'AU', 'BE', 'BG', 'BH', 'BO', 'BR', 'CA', 'CH', 'CL', 'CO', 'CR', 'CY', 'CZ', 'DE', 'DK', 'DO', 'DZ', 'EC', 'EE', 'EG', 'ES', 'FI', 'FR', 'GB', 'GR', 'GT', 'HK', 'HN', 'HU', 'ID', 'IE', 'IL', 'IN', 'IS', 'IT', 'JO', 'JP', 'KW', 'LB', 'LI', 'LT', 'LU', 'LV', 'MA', 'MC', 'MT', 'MX', 'MY', 'NI', 'NL', 'NO', 'NZ', 'OM', 'PA', 'PE', 'PH', 'PL', 'PS', 'PT', 'PY', 'QA', 'RO', 'SA', 'SE', 'SG', 'SK', 'SV', 'TH', 'TN', 'TR', 'TW', 'US', 'UY', 'VN', 'ZA']",17, im going under and this time i fear theres no one to save me this all or nothing really got a way of driving me crazy i need somebody to heal somebody to know somebody to have somebody to hold its easy to say but its never the same i guess i kinda liked the way you numbed all the pain now the day bleeds into nightfall and youre not here to get me through it all i let my guard down and then you pulled the rug i was getting kinda used to being someone you loved im going under and this time i fear theres no one to turn to this all or nothing way of loving got me sleeping without you now i need somebody to know somebody to heal somebody to have just to know how it feels its easy to say but its never the same i guess i kinda like the way you help me escape now the day bleeds into nightfall and youre not here to get me through it all i let my guard down and then you pulled the rug i was getting kinda used to being someone you loved and i tend to close my eyes when it hurts sometimes i fall into your arms ill be safe in your sound till i come back around for now the day bleeds into nightfall and youre not here to get me through it all i let my guard down and then you pulled the rug i was getting kinda used to being someone you loved but now the day bleeds into nightfall and youre not here to get me through it all i let my guard down and then you pulled the rug i was getting kinda used to being someone you loved i let my guard down and then you pulled the rug i was getting kinda used to being someone you loved ,Divinely Uninspired To A Hellish Extent,album,Universal,pop,5,2019,1,['Lewis Capaldi'],solo_male,89.0,89,3263298.0,3263298,35.86021505376344,17.54224181167664,86.0,[2],23,GB,1,1,4,0.751,0.501,0.405,0.0,0.105,-5.679,0.0319,0.446,109.891
top_2019,5w9c2J52mkdntKOmRLeM2m,Con Calma,193226,84,False,"['AD', 'AE', 'AR', 'AT', 'AU', 'BE', 'BG', 'BH', 'BO', 'BR', 'CA', 'CH', 'CL', 'CO', 'CR', 'CY', 'CZ', 'DE', 'DK', 'DO', 'DZ', 'EC', 'EE', 'EG', 'ES', 'FI', 'FR', 'GB', 'GR', 'GT', 'HK', 'HN', 'HU', 'ID', 'IE', 'IL', 'IN', 'IS', 'IT', 'JO', 'JP', 'KW', 'LB', 'LI', 'LT', 'LU', 'LV', 'MA', 'MC', 'MT', 'MX', 'MY', 'NI', 'NL', 'NO', 'NZ', 'OM', 'PA', 'PE', 'PH', 'PL', 'PS', 'PT', 'PY', 'QA', 'RO', 'SA', 'SE', 'SG', 'SK', 'SV', 'TH', 'TN', 'TR', 'TW', 'US', 'UY', 'VN', 'ZA']",9,  ddddddy play n skillz run cómo te llamas baby desde que te vi supe que eras pa mí dile a tus amigas que andamo ready esto lo seguimo en el after party cómo te llamas baby desde que te vi supe que eras pa mí dile a tus amigas que andamo ready esto lo seguimo en el after party con calma yo quiero ver como ella lo menea mueve ese poompoom girl es una asesina cuando baila quiere que to el mundo la vea i like your poompoom girl con calma yo quiero ver como ella lo menea mueve ese poompoom girl tiene adrenalina en medio e la pista vente hazme lo que sea i like your poompoom girl ya vi que estás solita acompáñame la noche es de nosotro tú lo sabe que ganas me dandandan de guayarte mami ese rampampam yeah esa criminal como lo mueve e un delito tengo que arrestarte porque empiezo y no me quito tienes criminality pero te doy fatality vívete la película flotando en mi gravity daddy pone las regla tiene que obedecer mami no tiene pausa qué e lo que vas a hacer échale échale échale pa atrás échale échale pa alante y pa atrás con calma yo quiero ver como ella lo menea mueve ese poompoom girl es una asesina cuando baila quiere que to el mundo la vea i like your poompoom girl con calma yo quiero ver como ella lo menea mueve ese poompoom girl tiene adrenalina en medio e la pista vente hazme lo que sea i like your poompoom girl tú tiene candela y yo tengo la vela llama el 911 se están quemando las suela me daña cuando la faldita esa me la modela mami tás enferma pero tu show no lo cancela te llaman a ti la reina del party mucha sandunga tiene ese body tírate un paso nonono pare wow dale dale somos dos bandido entre la rumba y romance y zúmbale dj otra ve pa que dance échale échale échale pa atrás échale échale pa alante y pa atrás con calma yo quiero ver como ella lo menea mueve ese poompoom girl es una asesina cuando baila quiere que to el mundo la vea i like your poompoom girl con calma yo quiero ver como ella lo menea mueve ese poompoom girl tiene adrenalina en medio e la pista vente hazme lo que sea i like your poompoom girl come with a nice young lady intelligent yes she gentle and irie everywhere me go me never lef her at allie yesa daddy snow me are the roam dance mana roam betweena dancin ina ina nationa you never know say daddy me snow me are the boom shakata me never laya down flat ina one cardboard boxa yesa daddy yankee mea go reachin out da top con calma yo quiero ver como ella lo menea mueve ese poompoom girl es una asesina cuando baila quiere que to el mundo la vea i like your poompoom girl con calma ya no say daddy me snow me i go blame i like your poompoom girl tective man a say say daddy me snow me stop a girl down the lane i love your poompoom girl ,Con Calma,single,Universal,latin/reggaeton,1,2019,0,"['Daddy Yankee', 'Snow']",group_male,82.0,92,8924233.5,17811023,52.77956989247312,14.771418675248883,72.0,"[0, 0]",47,"CA, PR",8,0,4,0.11,0.737,0.86,1.94e-06,0.0574,-2.652,0.0593,0.656,93.989
top_2019,2VxeLyX666F8uXCJ0dZF8B,Shallow,215733,87,False,"['AD', 'AE', 'AR', 'AT', 'AU', 'BE', 'BG', 'BH', 'BO', 'BR', 'CA', 'CH', 'CL', 'CO', 'CR', 'CY', 'CZ', 'DE', 'DK', 'DO', 'DZ', 'EC', 'EE', 'EG', 'ES', 'FI', 'FR', 'GB', 'GR', 'GT', 'HK', 'HN', 'HU', 'ID', 'IE', 'IL', 'IN', 'IS', 'IT', 'JO', 'JP', 'KW', 'LB', 'LI', 'LT', 'LU', 'LV', 'MA', 'MC', 'MT', 'MX', 'MY', 'NI', 'NL', 'NO', 'NZ', 'OM', 'PA', 'PE', 'PH', 'PL', 'PS', 'PT', 'PY', 'QA', 'RO', 'SA', 'SE', 'SG', 'SK', 'SV', 'TH', 'TN', 'TR', 'TW', 'US', 'UY', 'VN', 'ZA']",7, tell me somethin girl are you happy in this modern world or do you need more is there somethin else youre searchin for im fallin in all the good times i find myself longing for change and in the bad times i fear myself tell me something boy arent you tired tryna fill that void or do you need more aint it hard keepin it so hardcore im falling in all the good times i find myself longing for change and in the bad times i fear myself im off the deep end watch as i dive in ill never meet the ground crash through the surface where they cant hurt us were far from the shallow now in the shaha shahallow in the shaha shalalalalow in the shaha shallow were far from the shallow now oh ha ah ha ohah ha im off the deep end watch as i dive in ill never meet the ground crash through the surface where they cant hurt us were far from the shallow now in the shaha shallow in the shaha shalalalalow in the shaha shallow were far from the shallow now ,A Star Is Born Soundtrack,album,Universal,pop,10,2018,0,"['Lady Gaga', 'Bradley Cooper']",group_mixed,83.0,88,5774909.5,11409530,23.537634408602152,20.851271683684597,91.5,"[1, 1]",39,US,7,1,4,0.371,0.572,0.385,0.0,0.231,-6.362,0.0308,0.323,95.799
